{
  "$schema": "https://json-schema.org/draft/2020-12/schema",
  "x-select": ["decision"],
  "title": "Decision",
  "description": "One decision (De): a question settled, by the commander or by the pilot, so it is not reopened each session. Filed by identifier, De001.json.",
  "type": "object",
  "required": ["kind", "id", "date", "subject", "decision", "by"],
  "properties": {
    "kind": {
      "description": "the word decision, which is what chooses this schema",
      "const": "decision"
    },
    "id": {
      "description": "this decision's identifier, De and three digits, the same identifier the file is named for",
      "type": "string",
      "pattern": "^De[0-9]{3}$"
    },
    "date": {
      "description": "the day it was settled, YYYY-MM-DD",
      "type": "string",
      "pattern": "^[0-9]{4}-[0-9]{2}-[0-9]{2}$"
    },
    "subject": {
      "description": "the question, in a few words",
      "type": "string",
      "minLength": 1
    },
    "decision": {
      "description": "what was settled, stated so it can be applied without reading anything else",
      "type": "string",
      "minLength": 1
    },
    "by": {
      "description": "who settled it: the commander or the pilot",
      "enum": ["commander", "pilot"]
    },
    "request": {
      "description": "the request this decision answers, Rq and three digits; absent when the decision arose on its own",
      "type": "string",
      "pattern": "^Rq[0-9]{3}$"
    },
    "superseded_by": {
      "description": "the identifier of the later decision that overrides this one; absent while it stands",
      "type": "string",
      "pattern": "^De[0-9]{3}$"
    }
  }
}
